{
  "$schema": "http://json-schema.org/draft-07/schema#",
  "$id": "https://github.com/liatrio/arc/schemas/wave.schema.json",
  "title": "Wave",
  "description": "A delivery wave — the record that /arc-wave plans into docs/ROADMAP.md and that /arc-ship completes into docs/skill/arc/waves/NN-wave-name.md. Captures the wave's identity (number + name + theme), its goal, target timeframe, lifecycle status, and the set of ideas it delivers. When status is 'Completed', a 'completed' timestamp is required; at least one idea is always required.",
  "type": "object",
  "required": ["number", "name", "theme", "goal", "status", "ideas"],
  "additionalProperties": false,
  "properties": {
    "number": {
      "type": "integer",
      "minimum": 0,
      "description": "Zero-padded wave number (two digits when serialized as a filename). 0 is reserved for the uncategorized archive."
    },
    "name": {
      "type": "string",
      "minLength": 1,
      "description": "Short wave name, e.g. 'Wave Lifecycle Closure'."
    },
    "theme": {
      "type": "string",
      "minLength": 1,
      "description": "One-sentence thematic grouping."
    },
    "goal": {
      "type": "string",
      "minLength": 1,
      "description": "What this wave delivers and why it matters."
    },
    "target": {
      "type": "string",
      "description": "Target timeframe (e.g. '1-2 weeks', 'Q2 2026'). Set to 'TBD' when no estimate is captured; set to 'N/A' for the uncategorized archive. Optional only on the uncategorized fallback; present on all real waves."
    },
    "status": {
      "type": "string",
      "enum": ["Planned", "Active", "Completed"],
      "description": "Wave lifecycle status. 'Planned' and 'Active' live in ROADMAP; 'Completed' waves are archived to docs/skill/arc/waves/ and removed from ROADMAP."
    },
    "completed": {
      "type": "string",
      "description": "ISO 8601 timestamp when /arc-ship or /arc-sync archived the wave. Set to the literal 'N/A' on the uncategorized archive; required otherwise when status is 'Completed'.",
      "anyOf": [
        { "format": "date-time" },
        { "enum": ["N/A"] }
      ]
    },
    "ideas": {
      "type": "array",
      "minItems": 1,
      "description": "Ideas delivered by (or planned for) this wave. Each entry matches the backlog-entry.schema.json shape with status 'spec-ready' (Planned/Active) or 'shipped' (Completed archives).",
      "items": {
        "type": "object",
        "required": ["title"],
        "properties": {
          "title": { "type": "string", "minLength": 1 },
          "status": { "type": "string" },
          "priority": { "type": "string" }
        }
      }
    }
  },
  "allOf": [
    {
      "if": { "properties": { "status": { "const": "Completed" } }, "required": ["status"] },
      "then": { "required": ["number", "name", "theme", "goal", "status", "ideas", "completed"] }
    }
  ]
}
